{
    "$schema": "http://json-schema.org/draft-07/schema#",
    "definitions": {
        "EcosystemType": {
            "enum": [
                "article",
                "package",
                "podcast",
                "video"
            ],
            "type": "string"
        }
    },
    "properties": {
        "author": {
            "type": "string"
        },
        "author_url": {
            "type": "string"
        },
        "categories": {
            "items": {
                "enum": [
                    "add_on",
                    "build_utility",
                    "data",
                    "educational",
                    "plugin",
                    "primitive",
                    "router",
                    "starters",
                    "testing",
                    "ui"
                ],
                "type": "string"
            },
            "type": "array"
        },
        "description": {
            "type": "string"
        },
        "keywords": {
            "items": {
                "type": "string"
            },
            "type": "array"
        },
        "link": {
            "format": "uri",
            "type": "string"
        },
        "official": {
            "type": "boolean"
        },
        "published_at": {
            "format": "date-time",
            "type": "string"
        },
        "title": {
            "minLength": 1,
            "type": "string"
        },
        "type": {
            "$ref": "#/definitions/EcosystemType"
        }
    },
    "type": "object"
}

