{
  "link": "https://blog.openreplay.com/alternatives-to-react-solid-js",
  "title": "Alternatives to React: Solid JS",
  "description": "Alternatives to React is a series of articles looking at different JavaScript front-end frameworks.",
  "author": "Amazing Enyichi Agu",
  "author_url": "https://blog.openreplay.com/authors/amazing-enyichi-agu",
  "keywords": [
    "ui",
    "alternatives",
    "react"
  ],
  "type": "article",
  "categories": [
    "educational"
  ],
  "published_at": "2022-06-22T04:28:50.000Z"
}