{
  "title": "SolidJS with Ryan Carniato - JSJ 528",
  "link": "https://javascriptjabber.com/solidjs-with-ryan-carniato-jsj-528",
  "description": "SolidJS is a web development framework that focuses on using reactivity and carries forward several ideas from Knockout.js.",
  "author": "JavascriptJabber",
  "author_url": "https://javascriptjabber.com/",
  "keywords": [
    "javascript",
    "jabber",
    "knockout",
    "reactivity"
  ],
  "type": "podcast",
  "categories": [
    "educational"
  ],
  "published_at": "2022-04-22T16:59:26.000Z"
}