{
  "link": "https://blog.openreplay.com/solid-vs-react-the-fastest-vs-the-most-popular-ui-library",
  "title": "Solid vs React - the Fastest VS the Most Popular UI Library",
  "description": "An article presented by OpenReplay discussing the differences between React and Solid.",
  "author": "Arek Nawo",
  "author_url": "https://blog.openreplay.com/authors/arek-nawo",
  "keywords": [
    "react",
    "solid",
    "comparison"
  ],
  "type": "article",
  "categories": [
    "educational"
  ],
  "published_at": "2021-06-28T00:00:00.000Z"
}