{
  "link": "https://codechips.me/solidjs-first-look/",
  "title": "SolidJS - a first look",
  "description": "Ilia takes SolidJS for a spin and compare it to Svelte in terms of DevX",
  "author": "Ilia Mikhailov",
  "author_url": "https://codechips.me/",
  "keywords": [
    "mikhailov",
    "svelte",
    "codechips",
    "transitions"
  ],
  "type": "article",
  "categories": [
    "educational"
  ],
  "published_at": "2021-07-20T00:00:00.000Z"
}