{
  "link": "https://dev.to/ryansolid/why-solidjs-do-we-need-another-js-ui-library-1mdc",
  "title": "Why SolidJS: Do We Really Need Another JS UI Library",
  "description": "Ryan's personal journey creating SolidJS.",
  "author": "Ryan Carniato",
  "author_url": "https://www.github.com/ryansolid",
  "keywords": [
    ""
  ],
  "type": "article",
  "categories": [
    "educational"
  ],
  "published_at": "2020-06-01T07:07:47.000Z"
}