{
  "link": "https://www.youtube.com/watch?v=O4sgwuMQns0",
  "title": "The story of Solid JS and How its Different",
  "description": "Ryan joins ThePrimeagen to discuss Solid and where it has come from.",
  "keywords": [
    "history",
    "story",
    "solid",
    "ryan"
  ],
  "author": "ThePrimaegen",
  "author_url": "https://www.youtube.com/c/ThePrimeagen",
  "type": "video",
  "categories": [
    "educational"
  ],
  "published_at": "2022-06-03T17:24:36.000Z"
}