{
  "link": "https://suid.io",
  "title": "SUID - Material UI",
  "description": "A port of MUI built with SolidJS.",
  "author": "Juanra GM",
  "author_url": "https://github.com/juanrgm",
  "keywords": [
    "components",
    "material",
    "mui",
    "styled-component",
    "icons",
    "ui",
    "design"
  ],
  "official": false,
  "type": "package",
  "categories": [
    "ui",
    "add_on"
  ],
  "published_at": "2022-03-31T18:35:35.000Z"
}