{
  "link": "https://github.com/milahu/solidjs-treeview-component",
  "title": "solidjs-treeview-component",
  "description": "Interactive tree of nodes, expand/collapse, fetch child nodes on demand.",
  "author": "milahu",
  "author_url": "https://github.com/milahu",
  "keywords": [
    "tree",
    "expand",
    "collapse"
  ],
  "official": false,
  "type": "package",
  "categories": [
    "router"
  ]
}