{
  "link": "https://dev.to/ryansolid/server-rendering-in-javascript-optimizing-performance-1jnk",
  "title": "Server Rendering in JavaScript: Optimizing Performance",
  "description": "Ryan discusses his learning process in topics of perf and optimization.",
  "author": "Ryan Carniato",
  "author_url": "https://www.github.com/ryansolid",
  "keywords": [
    ""
  ],
  "type": "article",
  "categories": [
    "educational"
  ],
  "published_at": "2021-02-25T15:34:41.000Z"
}