{
  "link": "https://blog.logrocket.com/introduction-solidjs/",
  "title": "Introduction to SolidJS",
  "description": "An introduction to the SolidJS library.",
  "author": "Iniubong Obonguko (LockRocket)",
  "author_url": "https://blog.logrocket.com/author/iniubongobonguko/",
  "keywords": [
    "introduction"
  ],
  "type": "article",
  "categories": [
    "educational"
  ],
  "published_at": "2021-11-10T19:55:10.000Z"
}