{
  "link": "https://www.youtube.com/watch?v=REXtIuAJ3dE",
  "title": "Breaking Down the Web /w Dan Jutan",
  "description": "Dan Jutan, Solid Core Team member in charge of Documentation, joins Ryan to help give context for a lot of the topics he covers on stream.",
  "keywords": [
    "breaking down",
    "hydration",
    "ssr",
    "web",
    "streaming",
    "ryanstreams"
  ],
  "author": "Ryan Carniato",
  "author_url": "https://www.youtube.com/c/RyanCarniato9/videos",
  "type": "video",
  "categories": [
    "educational"
  ],
  "published_at": "2022-04-22T23:43:07.000Z"
}